C:\Users\pc\AppData\Roaming\Python\Python311\site-packages\numpy\core\_methods.py:206: RuntimeWarning: Degrees of freedom <= 0 for slice
  ret = _var(a, axis=axis, dtype=dtype, out=out, ddof=ddof,
C:\Users\pc\AppData\Roaming\Python\Python311\site-packages\numpy\core\_methods.py:198: RuntimeWarning: invalid value encountered in scalar divide
  ret = ret.dtype.type(ret / rcount)
C:\Users\pc\AppData\Roaming\Python\Python311\site-packages\numpy\core\_methods.py:206: RuntimeWarning: Degrees of freedom <= 0 for slice
  ret = _var(a, axis=axis, dtype=dtype, out=out, ddof=ddof,
C:\Users\pc\AppData\Roaming\Python\Python311\site-packages\numpy\core\_methods.py:198: RuntimeWarning: invalid value encountered in scalar divide
  ret = ret.dtype.type(ret / rcount)
C:\Users\pc\AppData\Roaming\Python\Python311\site-packages\numpy\core\_methods.py:206: RuntimeWarning: Degrees of freedom <= 0 for slice
  ret = _var(a, axis=axis, dtype=dtype, out=out, ddof=ddof,
C:\Users\pc\AppData\Roaming\Python\Python311\site-packages\numpy\core\_methods.py:198: RuntimeWarning: invalid value encountered in scalar divide
  ret = ret.dtype.type(ret / rcount)
C:\Users\pc\AppData\Roaming\Python\Python311\site-packages\numpy\core\_methods.py:206: RuntimeWarning: Degrees of freedom <= 0 for slice
  ret = _var(a, axis=axis, dtype=dtype, out=out, ddof=ddof,
C:\Users\pc\AppData\Roaming\Python\Python311\site-packages\numpy\core\_methods.py:198: RuntimeWarning: invalid value encountered in scalar divide
  ret = ret.dtype.type(ret / rcount)
C:\Users\pc\AppData\Roaming\Python\Python311\site-packages\numpy\core\_methods.py:206: RuntimeWarning: Degrees of freedom <= 0 for slice
  ret = _var(a, axis=axis, dtype=dtype, out=out, ddof=ddof,
C:\Users\pc\AppData\Roaming\Python\Python311\site-packages\numpy\core\_methods.py:198: RuntimeWarning: invalid value encountered in scalar divide
  ret = ret.dtype.type(ret / rcount)
C:\Users\pc\AppData\Roaming\Python\Python311\site-packages\numpy\core\_methods.py:206: RuntimeWarning: Degrees of freedom <= 0 for slice
  ret = _var(a, axis=axis, dtype=dtype, out=out, ddof=ddof,
C:\Users\pc\AppData\Roaming\Python\Python311\site-packages\numpy\core\_methods.py:198: RuntimeWarning: invalid value encountered in scalar divide
  ret = ret.dtype.type(ret / rcount)
C:\Users\pc\AppData\Roaming\Python\Python311\site-packages\numpy\core\_methods.py:206: RuntimeWarning: Degrees of freedom <= 0 for slice
  ret = _var(a, axis=axis, dtype=dtype, out=out, ddof=ddof,
C:\Users\pc\AppData\Roaming\Python\Python311\site-packages\numpy\core\_methods.py:198: RuntimeWarning: invalid value encountered in scalar divide
  ret = ret.dtype.type(ret / rcount)
C:\Users\pc\AppData\Roaming\Python\Python311\site-packages\numpy\core\_methods.py:206: RuntimeWarning: Degrees of freedom <= 0 for slice
  ret = _var(a, axis=axis, dtype=dtype, out=out, ddof=ddof,
C:\Users\pc\AppData\Roaming\Python\Python311\site-packages\numpy\core\_methods.py:198: RuntimeWarning: invalid value encountered in scalar divide
  ret = ret.dtype.type(ret / rcount)
C:\Users\pc\AppData\Roaming\Python\Python311\site-packages\numpy\core\_methods.py:206: RuntimeWarning: Degrees of freedom <= 0 for slice
  ret = _var(a, axis=axis, dtype=dtype, out=out, ddof=ddof,
C:\Users\pc\AppData\Roaming\Python\Python311\site-packages\numpy\core\_methods.py:198: RuntimeWarning: invalid value encountered in scalar divide
  ret = ret.dtype.type(ret / rcount)
C:\Users\pc\AppData\Roaming\Python\Python311\site-packages\numpy\core\_methods.py:206: RuntimeWarning: Degrees of freedom <= 0 for slice
  ret = _var(a, axis=axis, dtype=dtype, out=out, ddof=ddof,
C:\Users\pc\AppData\Roaming\Python\Python311\site-packages\numpy\core\_methods.py:198: RuntimeWarning: invalid value encountered in scalar divide
  ret = ret.dtype.type(ret / rcount)
C:\Users\pc\AppData\Roaming\Python\Python311\site-packages\numpy\core\_methods.py:206: RuntimeWarning: Degrees of freedom <= 0 for slice
  ret = _var(a, axis=axis, dtype=dtype, out=out, ddof=ddof,
C:\Users\pc\AppData\Roaming\Python\Python311\site-packages\numpy\core\_methods.py:198: RuntimeWarning: invalid value encountered in scalar divide
  ret = ret.dtype.type(ret / rcount)
C:\Users\pc\AppData\Roaming\Python\Python311\site-packages\numpy\core\_methods.py:206: RuntimeWarning: Degrees of freedom <= 0 for slice
  ret = _var(a, axis=axis, dtype=dtype, out=out, ddof=ddof,
C:\Users\pc\AppData\Roaming\Python\Python311\site-packages\numpy\core\_methods.py:198: RuntimeWarning: invalid value encountered in scalar divide
  ret = ret.dtype.type(ret / rcount)
C:\Users\pc\AppData\Roaming\Python\Python311\site-packages\numpy\core\_methods.py:206: RuntimeWarning: Degrees of freedom <= 0 for slice
  ret = _var(a, axis=axis, dtype=dtype, out=out, ddof=ddof,
C:\Users\pc\AppData\Roaming\Python\Python311\site-packages\numpy\core\_methods.py:198: RuntimeWarning: invalid value encountered in scalar divide
  ret = ret.dtype.type(ret / rcount)
C:\Users\pc\AppData\Roaming\Python\Python311\site-packages\numpy\core\_methods.py:206: RuntimeWarning: Degrees of freedom <= 0 for slice
  ret = _var(a, axis=axis, dtype=dtype, out=out, ddof=ddof,
C:\Users\pc\AppData\Roaming\Python\Python311\site-packages\numpy\core\_methods.py:198: RuntimeWarning: invalid value encountered in scalar divide
  ret = ret.dtype.type(ret / rcount)
================================================================================
AUTOMATIC PARAMETER TUNING AND PROCESSING
================================================================================

Found 14 patients with RDV1 data

================================================================================
[1/14] 02-P-FN
================================================================================

[TUNING] 02-P-FN...
  [Default             ] [100, 30, -300, 30, 10] -> FAILED
  [Gentle              ] [80, 25, -250, 30, 10] -> FAILED
  [Very_Gentle         ] [70, 20, -200, 25, 10] -> FAILED
  [Extra_Gentle        ] [60, 18, -180, 20, 10] -> FAILED
  [Slightly_Gentle     ] [90, 28, -280, 28, 10] -> FAILED
  [Slightly_Strict     ] [110, 32, -320, 32, 10] -> FAILED
  [Strict              ] [120, 35, -350, 30, 10] -> FAILED
  [RESULT] All parameter sets failed!
[FAILED] Could not find working parameters

================================================================================
[2/14] 03-P-PJ
================================================================================

[TUNING] 03-P-PJ...
  [Default             ] [100, 30, -300, 30, 10] -> 3.89% error
  [Gentle              ] [80, 25, -250, 30, 10] -> 4.20% error
  [Very_Gentle         ] [70, 20, -200, 25, 10] -> 3.61% error
  [Extra_Gentle        ] [60, 18, -180, 20, 10] -> FAILED
  [Slightly_Gentle     ] [90, 28, -280, 28, 10] -> 3.84% error
  [Slightly_Strict     ] [110, 32, -320, 32, 10] -> 4.59% error
  [Strict              ] [120, 35, -350, 30, 10] -> 4.55% error
  [RESULT] Best: Very_Gentle -> 3.61% error

[PROCESSING] Using Very_Gentle parameters: [70, 20, -200, 25, 10]
[SUCCESS] 03-P-PJ processed with Very_Gentle parameters

================================================================================
[3/14] 05-P-GC
================================================================================

[TUNING] 05-P-GC...
  [Default             ] [100, 30, -300, 30, 10] -> 4.73% error
  [Gentle              ] [80, 25, -250, 30, 10] -> 6.09% error
  [Very_Gentle         ] [70, 20, -200, 25, 10] -> 5.12% error
  [Extra_Gentle        ] [60, 18, -180, 20, 10] -> 15.41% error
  [Slightly_Gentle     ] [90, 28, -280, 28, 10] -> 8.07% error
  [Slightly_Strict     ] [110, 32, -320, 32, 10] -> 5.15% error
  [Strict              ] [120, 35, -350, 30, 10] -> 4.70% error
  [RESULT] Best: Strict -> 4.70% error

[PROCESSING] Using Strict parameters: [120, 35, -350, 30, 10]
[SUCCESS] 05-P-GC processed with Strict parameters

================================================================================
[4/14] 08-P-KM
================================================================================

[TUNING] 08-P-KM...
  [Default             ] [100, 30, -300, 30, 10] -> 11.14% error
  [Gentle              ] [80, 25, -250, 30, 10] -> 11.57% error
  [Very_Gentle         ] [70, 20, -200, 25, 10] -> 5.79% error
  [Extra_Gentle        ] [60, 18, -180, 20, 10] -> 14.05% error
  [Slightly_Gentle     ] [90, 28, -280, 28, 10] -> 11.19% error
  [Slightly_Strict     ] [110, 32, -320, 32, 10] -> 10.29% error
  [Strict              ] [120, 35, -350, 30, 10] -> 10.70% error
  [RESULT] Best: Very_Gentle -> 5.79% error

[PROCESSING] Using Very_Gentle parameters: [70, 20, -200, 25, 10]
[SUCCESS] 08-P-KM processed with Very_Gentle parameters

================================================================================
[5/14] 10-P-RA
================================================================================

[TUNING] 10-P-RA...
  [Default             ] [100, 30, -300, 30, 10] -> FAILED
  [Gentle              ] [80, 25, -250, 30, 10] -> FAILED
  [Very_Gentle         ] [70, 20, -200, 25, 10] -> FAILED
  [Extra_Gentle        ] [60, 18, -180, 20, 10] -> FAILED
  [Slightly_Gentle     ] [90, 28, -280, 28, 10] -> FAILED
  [Slightly_Strict     ] [110, 32, -320, 32, 10] -> FAILED
  [Strict              ] [120, 35, -350, 30, 10] -> FAILED
  [RESULT] All parameter sets failed!
[FAILED] Could not find working parameters

================================================================================
[6/14] 11-P-BK
================================================================================

[TUNING] 11-P-BK...
  [Default             ] [100, 30, -300, 30, 10] -> 39.28% error
  [Gentle              ] [80, 25, -250, 30, 10] -> 40.84% error
  [Very_Gentle         ] [70, 20, -200, 25, 10] -> 55.72% error
  [Extra_Gentle        ] [60, 18, -180, 20, 10] -> 74.26% error
  [Slightly_Gentle     ] [90, 28, -280, 28, 10] -> 49.56% error
  [Slightly_Strict     ] [110, 32, -320, 32, 10] -> 46.48% error
  [Strict              ] [120, 35, -350, 30, 10] -> FAILED
  [RESULT] Best: Default -> 39.28% error

[PROCESSING] Using Default parameters: [100, 30, -300, 30, 10]
[SUCCESS] 11-P-BK processed with Default parameters

================================================================================
[7/14] 12-P-KH
================================================================================

[TUNING] 12-P-KH...
  [Default             ] [100, 30, -300, 30, 10] -> 9.73% error
  [Gentle              ] [80, 25, -250, 30, 10] -> 8.56% error
  [Very_Gentle         ] [70, 20, -200, 25, 10] -> 3.66% error
  [Extra_Gentle        ] [60, 18, -180, 20, 10] -> FAILED
  [Slightly_Gentle     ] [90, 28, -280, 28, 10] -> 11.34% error
  [Slightly_Strict     ] [110, 32, -320, 32, 10] -> 10.75% error
  [Strict              ] [120, 35, -350, 30, 10] -> 13.43% error
  [RESULT] Best: Very_Gentle -> 3.66% error

[PROCESSING] Using Very_Gentle parameters: [70, 20, -200, 25, 10]
[SUCCESS] 12-P-KH processed with Very_Gentle parameters

================================================================================
[8/14] 16-P-GT
================================================================================

[TUNING] 16-P-GT...
  [Default             ] [100, 30, -300, 30, 10] -> 21.69% error
  [Gentle              ] [80, 25, -250, 30, 10] -> 11.50% error
  [Very_Gentle         ] [70, 20, -200, 25, 10] -> 11.65% error
  [Extra_Gentle        ] [60, 18, -180, 20, 10] -> 4.44% error
  [Slightly_Gentle     ] [90, 28, -280, 28, 10] -> 15.39% error
  [Slightly_Strict     ] [110, 32, -320, 32, 10] -> 21.80% error
  [Strict              ] [120, 35, -350, 30, 10] -> 24.29% error
  [RESULT] Best: Extra_Gentle -> 4.44% error

[PROCESSING] Using Extra_Gentle parameters: [60, 18, -180, 20, 10]
[SUCCESS] 16-P-GT processed with Extra_Gentle parameters

================================================================================
[9/14] 18-P-EE
================================================================================

[TUNING] 18-P-EE...
  [Default             ] [100, 30, -300, 30, 10] -> 5.05% error
  [Gentle              ] [80, 25, -250, 30, 10] -> 5.19% error
  [Very_Gentle         ] [70, 20, -200, 25, 10] -> 5.25% error
  [Extra_Gentle        ] [60, 18, -180, 20, 10] -> FAILED
  [Slightly_Gentle     ] [90, 28, -280, 28, 10] -> 5.13% error
  [Slightly_Strict     ] [110, 32, -320, 32, 10] -> 4.98% error
  [Strict              ] [120, 35, -350, 30, 10] -> 4.99% error
  [RESULT] Best: Slightly_Strict -> 4.98% error

[PROCESSING] Using Slightly_Strict parameters: [110, 32, -320, 32, 10]
[SUCCESS] 18-P-EE processed with Slightly_Strict parameters

================================================================================
[10/14] 19-P-CR
================================================================================

[TUNING] 19-P-CR...
  [Default             ] [100, 30, -300, 30, 10] -> 10.47% error
  [Gentle              ] [80, 25, -250, 30, 10] -> 8.92% error
  [Very_Gentle         ] [70, 20, -200, 25, 10] -> 5.18% error
  [Extra_Gentle        ] [60, 18, -180, 20, 10] -> 63.26% error
  [Slightly_Gentle     ] [90, 28, -280, 28, 10] -> 5.49% error
  [Slightly_Strict     ] [110, 32, -320, 32, 10] -> 9.65% error
  [Strict              ] [120, 35, -350, 30, 10] -> 9.45% error
  [RESULT] Best: Very_Gentle -> 5.18% error

[PROCESSING] Using Very_Gentle parameters: [70, 20, -200, 25, 10]
[SUCCESS] 19-P-CR processed with Very_Gentle parameters

================================================================================
[11/14] 22-P-OA
================================================================================

[TUNING] 22-P-OA...
  [Default             ] [100, 30, -300, 30, 10] -> 9.86% error
  [Gentle              ] [80, 25, -250, 30, 10] -> 8.08% error
  [Very_Gentle         ] [70, 20, -200, 25, 10] -> 8.38% error
  [Extra_Gentle        ] [60, 18, -180, 20, 10] -> 13.46% error
  [Slightly_Gentle     ] [90, 28, -280, 28, 10] -> 7.04% error
  [Slightly_Strict     ] [110, 32, -320, 32, 10] -> 9.12% error
  [Strict              ] [120, 35, -350, 30, 10] -> 11.30% error
  [RESULT] Best: Slightly_Gentle -> 7.04% error

[PROCESSING] Using Slightly_Gentle parameters: [90, 28, -280, 28, 10]
[SUCCESS] 22-P-OA processed with Slightly_Gentle parameters

================================================================================
[12/14] 24-P-SA
================================================================================

[TUNING] 24-P-SA...
  [Default             ] [100, 30, -300, 30, 10] -> 13.18% error
  [Gentle              ] [80, 25, -250, 30, 10] -> 14.10% error
  [Very_Gentle         ] [70, 20, -200, 25, 10] -> 7.11% error
  [Extra_Gentle        ] [60, 18, -180, 20, 10] -> FAILED
  [Slightly_Gentle     ] [90, 28, -280, 28, 10] -> 15.89% error
  [Slightly_Strict     ] [110, 32, -320, 32, 10] -> 12.81% error
  [Strict              ] [120, 35, -350, 30, 10] -> 15.23% error
  [RESULT] Best: Very_Gentle -> 7.11% error

[PROCESSING] Using Very_Gentle parameters: [70, 20, -200, 25, 10]
[SUCCESS] 24-P-SA processed with Very_Gentle parameters

================================================================================
[13/14] 25-P-LS
================================================================================

[TUNING] 25-P-LS...
  [Default             ] [100, 30, -300, 30, 10] -> FAILED
  [Gentle              ] [80, 25, -250, 30, 10] -> FAILED
  [Very_Gentle         ] [70, 20, -200, 25, 10] -> FAILED
  [Extra_Gentle        ] [60, 18, -180, 20, 10] -> FAILED
  [Slightly_Gentle     ] [90, 28, -280, 28, 10] -> FAILED
  [Slightly_Strict     ] [110, 32, -320, 32, 10] -> FAILED
  [Strict              ] [120, 35, -350, 30, 10] -> FAILED
  [RESULT] All parameter sets failed!
[FAILED] Could not find working parameters

================================================================================
[14/14] 29-P-DP
================================================================================

[TUNING] 29-P-DP...
  [Default             ] [100, 30, -300, 30, 10] -> 6.17% error
  [Gentle              ] [80, 25, -250, 30, 10] -> 6.19% error
  [Very_Gentle         ] [70, 20, -200, 25, 10] -> 4.60% error
  [Extra_Gentle        ] [60, 18, -180, 20, 10] -> FAILED
  [Slightly_Gentle     ] [90, 28, -280, 28, 10] -> 5.95% error
  [Slightly_Strict     ] [110, 32, -320, 32, 10] -> 6.60% error
  [Strict              ] [120, 35, -350, 30, 10] -> 6.28% error
  [RESULT] Best: Very_Gentle -> 4.60% error

[PROCESSING] Using Very_Gentle parameters: [70, 20, -200, 25, 10]
[SUCCESS] 29-P-DP processed with Very_Gentle parameters

================================================================================
TUNING & PROCESSING SUMMARY
================================================================================

Total: 14
Success: 11
Failed: 3

Patient      Params                    Match Quality
------------------------------------------------------------
03-P-PJ      Very_Gentle               3.61%
05-P-GC      Strict                    4.70%
08-P-KM      Very_Gentle               5.79%
11-P-BK      Default                   39.28%
12-P-KH      Very_Gentle               3.66%
16-P-GT      Extra_Gentle              4.44%
18-P-EE      Slightly_Strict           4.98%
19-P-CR      Very_Gentle               5.18%
22-P-OA      Slightly_Gentle           7.04%
24-P-SA      Very_Gentle               7.11%
29-P-DP      Very_Gentle               4.60%

[OK] Summary saved: C:\Users\pc\Documents\Lina\IA2S\gait analysis\output\hemiparetic_tuned\tuning_summary.csv

================================================================================
DONE!
================================================================================
